global_problem_id,problem_code,title,rating,tags,scrape_url,editorial_url,editorial_status,editorial_parse_method,editorial_problem_code,editorial_text_chars,editorial_toggle_count,problem_code_ok,placeholder_removed,has_min_text,verified,preview
codeforces_2219_A,2219A,Grid L,1400.0,"['brute force', 'constructive algorithms', 'math', 'number theory']",https://codeforces.com/contest/2219/problem/A,https://codeforces.com/blog/entry/152936,downloaded,codeforces_ajax_problemTutorial,2219A,1787,3,True,True,True,True,"Hint1: We want an easy to check condition on $$$m$$$, $$$n$$$, $$$p$$$, $$$q$$$ that is equivalent to being able to fill the grid.  Hint2 (strong spoiler): You can fill the $$$m\times n$$$ grid if and only if $$$p+2q = m(n+1)+n(m+1)$$$ and "
codeforces_2219_B1,2219B1,Unique Values (Easy version),1900.0,"['binary search', 'constructive algorithms', 'divide and conquer', 'interactive', 'math']",https://codeforces.com/contest/2219/problem/B1,https://codeforces.com/blog/entry/152936,downloaded,codeforces_ajax_problemTutorial,2219B1,948,0,True,True,True,True,"Solution: There are many solutions that use $$$6 \cdot \log_2(2 \cdot n + 1)$$$ queries. Here is one: Notice that if we query for the set $$$S$$$ and its complement $$$T$$$ (i.e. $$$T = \{1, 2, \ldots, 2 \cdot n + 1\} \setminus S$$$) we can"
codeforces_2219_C,2219C,Coloring a Red Black Tree,2300.0,"['dfs and similar', 'dp', 'greedy', 'math', 'probabilities', 'trees']",https://codeforces.com/contest/2219/problem/C,https://codeforces.com/blog/entry/152936,downloaded,codeforces_ajax_problemTutorial,2219C,1805,1,True,True,True,True,"Hint1: Think of some kind of subtree DP.  Solution: In this solution, I will use without mentioning the fact that the expected value of a geometric distribution is $$$\frac{1}{p}$$$ and linearity of expectation. Firstly, let's split the tre"
codeforces_2219_D,2219D,MEX Replacement on Tree,2700.0,"['data structures', 'implementation', 'math', 'trees']",https://codeforces.com/contest/2219/problem/D,https://codeforces.com/blog/entry/152936,downloaded,codeforces_ajax_problemTutorial,2219D,3714,6,True,True,True,True,"Hint1: Having a good visual image of the problem in mind may help. That is, for each vertex, thinking there is an array of infinite slot, and some of them are occupied by token, and the operation correspond to moving certain token to the fi"
codeforces_2219_E,2219E,Weird Chessboard,3500.0,"['constructive algorithms', 'math']",https://codeforces.com/contest/2219/problem/E,https://codeforces.com/blog/entry/152936,downloaded,codeforces_ajax_problemTutorial,2219E,6973,10,True,True,True,True,"Hint1: Can you rewrite the condition on the board to something simpler?  Hint2: Label the board $$$v_{i,j}$$$ where $$$v_{0,0}$$$ is the top left cell. We work mod $$$2$$$. A board $$$v_{i,j}$$$ is valid if and only if $$$v_{i,j}+v_{i+1,j}+"
codeforces_2220_A,2220A,Blocked,800.0,"['greedy', 'sortings']",https://codeforces.com/contest/2220/problem/A,https://codeforces.com/blog/entry/152936,downloaded,codeforces_ajax_problemTutorial,2220A,175,1,True,True,True,True,"Hint1: What happens when there are two equal elements?  Solution: If there are two equal elements in $$$a$$$, one of them will be blocked . Otherwise, sort $$$a$$$ decreasing."
codeforces_2220_B,2220B,OIE Excursion,1200.0,['greedy'],https://codeforces.com/contest/2220/problem/B,https://codeforces.com/blog/entry/152936,downloaded,codeforces_ajax_problemTutorial,2220B,729,0,True,True,True,True,"Solution: If there exists a contiguous subarray of equal values with length ≥ m, it is impossible to escape. This is because crossing such a block requires at least m seconds, and each position will look in direction 0 at least once in any "
